Program Name,Address,Neighbourhood,Phone,Email,Website,Languages,Age Groups,Provider Contact Date,Vacancies
Happy House In Home Muti-Age Child Care,720 E 61st Ave,Sunset,604-803-8325,farhana.hossain197423@gmail.com,,English,5 - 12 yrs; 2.5 - 5 yrs; 0 - 18 mo; 19 - 36 mo,April 8,1 spot for under 36 months and 1 spot for over 36 months
Little Stars Child Care on East 58th,969 East 58th Avenue,Sunset,778-889-9654,jamesmarshal@hotmail.com,,English,0 - 18 mo; 19 - 36 mo,April 7,Spots available for infant/toddler
Cats in the Cradle (RLNR),Smithe Street and Thurlow Street,West End,778-316-2020,,,English,0 - 18 mo; 19 - 36 mo,April 7,Waitlist currently open accepting 6-20 months old
Langara Stars Muti-Age Daycare (Group Centre),7430 Cambie Street,Oakridge,778-865-4842,zfarro@gmail.com,,English; Farsi; Thai,5 - 12 yrs; 2.5 - 5 yrs; 0 - 18 mo,March 31,2 spots available for under 3 years old
Arbutus Child Care & Fine Art Learning Centre,4051 Macdonald Street,Arbutus Ridge,604-223-5888,info@arbutuschildcare.com,https://www.arbutuschildcare.com/,English,0 - 18 mo; 19 - 36 mo,February 23,2 spots for infant room under 1.5 years old; 4 spots available for toddler room 1.5 to 3 years old
Maple House Academy (Group Child Care for under 3),2979 West 41st Avenue,Dunbar-Southlands,604-275-6666,info.mhchildcare@gmail.com,,English; Mandarin; Cantonese,0 - 18 mo; 19 - 36 mo,February 12,Spots available for 8 months to 1.5 years from March to June 2026
The Big Play House (Infant/Toddler Program),249 East 57th Avenue,Sunset,236-975-1611,thebigplayhouse@outlook.com,,English,0 - 18 mo; 19 - 36 mo,February 5,6 full time spots available for 6 months and over in September; *249 E 57th Ave* location
